{
  "symbol": "XAUUSD",
  "analysis_timestamp": "2026-02-01T09:23:35.939844",
  "evaluation_timestamp": "2026-02-03T09:00:31.555151",
  "price_at_analysis": 4885.6,
  "price_at_evaluation": 4682.7,
  "pct_change": -4.153021123301141,
  "expected_direction": "up",
  "actual_direction": "down",
  "signal": "BUY",
  "prediction_correct": false,
  "hypothetical_pnl": -4.153021123301141,
  "lesson": "### Analysis of Prediction Outcome and Lessons for Improvement\n\nThe prediction made for XAUUSD was a **BUY** signal with an expected upward price movement. However, the actual outcome after 24 hours showed a downward movement of -4.15%, with the price dropping from $4885.60 to $4682.70. This resulted in a loss, as the price moved closer to the stop-loss level ($4609.5578) rather than the take-profit levels ($5353.89652 and $5500.0). Below is a structured analysis of the outcome, focusing on lessons and actionable insights for future predictions.\n\n---\n\n### Key Observations from Prediction and Outcome\n1. **Incorrect Directional Forecast**:\n   - The prediction anticipated an upward movement, but the price declined by 4.15% within 24 hours. This suggests a misjudgment in the market trend or an overreliance on certain factors that did not materialize as expected.\n\n2. **Volatility Context (ATR)**:\n   - The ATR (14) value of 183.96880 (3.77% of the price) indicated relatively high volatility. Despite this, the prediction did not account for the potential for a sharp downward move, which fell within the volatility range.\n\n3. **Risk Management**:\n   - The stop-loss was set at $4609.5578 (a 5.66% drop from entry), and the take-profit levels offered a risk/reward ratio of 1.70, which is reasonable. However, the price drop triggered a significant loss close to the stop-loss level.\n   - Position sizing was reduced to 4% of the portfolio, which mitigated the overall impact of the loss\u2014a positive risk management decision.\n\n4. **Confidence and Risk Level**:\n   - Confidence was rated at 75%, and the risk level was medium. The confidence may have been overestimated given the outcome, suggesting a need for recalibrating how confidence is assessed.\n\n5. **Rationale and Analyst Perspectives**:\n   - The decision to buy was based on alignment with Risky and Neutral analyst perspectives, but the Safe perspective was seemingly underweighted. This may have led to an overly optimistic outlook.\n\n---\n\n### Lessons Learned and Actionable Insights for Improvement\nTo improve future predictions, the following lessons and actionable steps are derived from the analysis. These focus on enhancing accuracy, risk management, and decision-making processes.\n\n#### 1. Refine Trend Analysis and Incorporate Contrarian Indicators\n   - **Lesson**: The incorrect directional forecast suggests that the trend analysis or indicators used may have been misleading or incomplete. The high volatility (ATR of 3.77%) should have prompted caution about potential reversals.\n   - **Actionable Insight**:\n     - Integrate more robust trend confirmation tools, such as moving averages (e.g., 50-day and 200-day) or momentum indicators (e.g., RSI, MACD), to validate the predicted direction.\n     - Use contrarian indicators or sentiment analysis (e.g., overbought/oversold conditions) to assess the likelihood of reversals, especially in high-volatility environments.\n     - Revisit the weighting of analyst perspectives (Risky, Neutral, Safe) to ensure a balanced view. For instance, give more consideration to the Safe perspective in volatile markets.\n\n#### 2. Enhance Volatility-Based Risk Assessment\n   - **Lesson**: While volatility was noted (ATR of 3.77%), the prediction did not adequately account for the possibility of a significant downward move within the volatility range. The price drop of 4.15% was within the expected range of movement but not in the anticipated direction.\n   - **Actionable Insight**:\n     - Adjust stop-loss and take-profit levels based on ATR multiples to better align with current volatility. For instance, set stop-loss at 1.5x ATR below entry and take-profit at 2x ATR above entry for a more dynamic risk/reward setup.\n     - In high-volatility conditions, consider reducing position sizing further (e.g., to 2-3% of the portfolio) to limit exposure to sudden adverse moves.\n\n#### 3. Incorporate Real-Time News and Sentiment Analysis More Effectively\n   - **Lesson**: While the analysis included news and sentiment reports, the outcome suggests that critical bearish factors (e.g., macroeconomic events or negative sentiment) may have been overlooked or underweighted.\n   - **Actionable Insight**:\n     - Develop a systematic scoring system for news and sentiment impact (e.g., assign weights to bullish/bearish news based on relevance and source credibility) to quantify their influence on the prediction.\n     - Monitor real-time updates during the trade window (e.g., central bank announcements, geopolitical events) that could impact XAUUSD, especially given gold\u2019s sensitivity to macroeconomic factors.\n     - Cross-reference social media sentiment with historical correlations to price movements to improve predictive accuracy.\n\n#### 4. Reassess Confidence Calibration\n   - **Lesson**: The 75% confidence rating was likely overestimated, as the prediction failed. Overconfidence may lead to larger position sizing or insufficient hedging.\n   - **Actionable Insight**:\n     - Implement a more rigorous confidence assessment framework by backtesting predictions against historical data to establish realistic confidence thresholds.\n     - Tie confidence levels to measurable factors, such as the strength of technical indicators, alignment of analyst perspectives, and historical success rates of similar setups.\n     - Consider lowering confidence ratings in high-volatility or uncertain market conditions to encourage more conservative trading decisions.\n\n#### 5. Improve Post-Trade Feedback Loops\n   - **Lesson**: The analysis provided limited detail on why the prediction failed, such as specific news events or technical breakdowns that led to the downward move.\n   - **Actionable Insight**:\n     - Conduct a detailed post-mortem for every trade to identify the root cause of incorrect predictions. For example, analyze whether a specific news event, technical breakdown (e.g., support level breach), or sentiment shift caused the price drop.\n     - Maintain a trading journal or database to track prediction outcomes, reasons for success/failure, and lessons learned. Use this data to refine future strategies.\n     - Incorporate machine learning or statistical models to identify patterns in past failures and adjust prediction algorithms accordingly.\n\n#### 6. Optimize Risk/Reward and Exit Strategies\n   - **Lesson**: While the risk/reward ratio of 1.70 was reasonable, the rapid price drop suggests that tighter stop-losses or trailing stops could have minimized losses. Additionally, the take-profit levels may have been overly ambitious given the volatility.\n   - **Actionable Insight**:\n     - Experiment with dynamic exit strategies, such as trailing stops, to lock in profits or limit losses as the price moves.\n     - Set more conservative take-profit targets in volatile markets (e.g., closer to 1x ATR) to increase the likelihood of realizing gains before a reversal.\n     - Consider partial profit-taking at intermediate levels (e.g., take 50% off at Take Profit 1) to reduce exposure while maintaining potential upside.\n\n---\n\n### Summary of Key Improvements\n| **Area of Improvement**            | **Actionable Steps**                                                                                     |\n|-------------------------------------|---------------------------------------------------------------------------------------------------------|\n| Trend Analysis                      | Use trend confirmation tools (e.g., moving averages, RSI) and balance analyst perspectives.             |\n| Volatility Assessment               | Adjust stop-loss/take-profit based on ATR multiples; reduce position sizing in high volatility.         |\n| News and Sentiment Integration      | Develop a scoring system for news impact; monitor real-time updates for XAUUSD.                        |\n| Confidence Calibration              | Backtest confidence levels; tie ratings to measurable factors; lower confidence in uncertain conditions. |\n| Post-Trade Feedback                 | Conduct trade post-mortems; maintain a trading journal; use data to refine strategies.                  |\n| Risk/Reward and Exit Strategies     | Use trailing stops; set conservative take-profit targets; take partial profits at intermediate levels.  |\n\n---\n\n### Conclusion\nThe incorrect BUY prediction for XAUUSD highlights the importance of robust trend analysis, dynamic risk management, and effective integration of news and sentiment data. By implementing the actionable insights outlined above, future predictions can be improved in terms of accuracy and loss mitigation. Key priorities include refining volatility-based strategies, recalibrating confidence levels, and establishing systematic feedback loops to learn from past trades. These steps will help build a more resilient and data-driven trading approach."
}