{
  "symbol": "XAUUSD",
  "analysis_timestamp": "2026-02-02T08:16:21.907493",
  "evaluation_timestamp": "2026-02-03T09:05:46.744163",
  "price_at_analysis": 4885.6,
  "price_at_evaluation": 4682.7,
  "pct_change": -4.153021123301141,
  "expected_direction": "up",
  "actual_direction": "down",
  "signal": "BUY",
  "prediction_correct": false,
  "hypothetical_pnl": -4.153021123301141,
  "lesson": "### Analysis of Prediction Outcome and Lessons for Improvement\n\nThe prediction made for XAUUSD was a BUY signal with an expected upward direction. However, the actual outcome showed a downward movement of -4.15% within 24 hours, resulting in a price drop from $4885.60 to $4682.70. This incorrect prediction triggered the stop loss at $4691.69, leading to a loss. Below is a structured analysis of the outcome and actionable lessons for improving future predictions.\n\n---\n\n### Key Observations from Prediction and Outcome\n1. **Prediction Confidence and Risk Level**:\n   - Confidence was rated at 70%, which is moderate, and the risk level was medium. Despite this, the prediction failed, suggesting that the confidence assessment may have been overly optimistic or based on incomplete data.\n   - The risk/reward ratio of 1.50 indicates a reasonable setup, but the stop loss was hit quickly, implying the market moved against the prediction faster than anticipated.\n\n2. **Technical Indicators**:\n   - Some requested indicators (e.g., MACD Histogram, Bollinger Bands upper/lower) were unsupported by the system, potentially limiting the depth of technical analysis.\n   - Supported indicators (e.g., SMA, EMA, MACD, RSI) were used, but their specific values or interpretations were not detailed in the provided excerpt. This raises questions about whether these indicators strongly supported the BUY signal or if their signals were mixed.\n\n3. **Market and Sentiment Analysis**:\n   - The analysis included market data, news, and social media sentiment reports for XAUUSD, but specific insights or conclusions from these reports (e.g., bullish or bearish sentiment, key economic drivers) were not summarized in the provided text.\n   - Gold (XAUUSD) is often influenced by macroeconomic factors like interest rates, inflation expectations, and geopolitical events. The report mentions a \"comprehensive global economic state\" analysis, but it is unclear how these factors were weighted in the BUY decision.\n\n4. **Position Sizing and Risk Management**:\n   - Position sizing was reduced to 1% of the portfolio, which minimized the overall loss. This conservative approach was a positive aspect of the trade setup.\n   - However, the stop loss placement at $4691.69 (a ~4% drop from entry) may not have accounted for short-term volatility in gold prices, which can be significant.\n\n5. **Outcome Timing**:\n   - The price dropped by 4.15% within 24 hours, suggesting a rapid adverse movement. This could indicate an unforeseen event, incorrect timing of the entry, or a misjudgment of short-term market momentum.\n\n---\n\n### Lessons for Improvement\n#### 1. Enhance Data Completeness and Indicator Coverage\n   - **Issue**: Missing indicators (e.g., MACD Histogram, Bollinger Bands) limited the technical analysis, potentially leading to an incomplete picture of market conditions.\n   - **Actionable Insight**: Ensure access to a broader range of technical indicators or develop alternative methods to approximate missing data (e.g., manual calculations or proxy indicators). If system limitations persist, adjust confidence levels downward to reflect reduced data reliability.\n   - **Implementation**: Prioritize platforms or tools that support a full suite of technical indicators. Alternatively, integrate qualitative analysis (e.g., price action patterns) to compensate for missing quantitative data.\n\n#### 2. Refine Confidence and Risk Assessment\n   - **Issue**: A 70% confidence level was assigned despite missing data and a medium risk level, which may have been overly optimistic given the outcome.\n   - **Actionable Insight**: Develop a more rigorous framework for assigning confidence scores, incorporating factors such as data completeness, historical accuracy of similar setups, and alignment of multiple analysis sources (technical, fundamental, sentiment).\n   - **Implementation**: Create a checklist for confidence scoring (e.g., 80%+ requires strong alignment across all data points; 60-70% reflects partial alignment or data gaps). Reduce confidence and position sizing further when key data is missing.\n\n#### 3. Strengthen Integration of Macroeconomic and Sentiment Analysis\n   - **Issue**: While news and sentiment reports were prepared, it is unclear how they influenced the BUY decision or whether bearish signals were overlooked.\n   - **Actionable Insight**: Explicitly document how macroeconomic factors (e.g., interest rate expectations, USD strength) and sentiment (e.g., social media trends) align with the technical analysis. Weight these factors based on their historical impact on XAUUSD.\n   - **Implementation**: Use a scoring system for fundamental and sentiment analysis (e.g., +1 for bullish news, -1 for bearish) and integrate this into the final decision. If sentiment or news contradicts technical signals, consider a neutral stance or delayed entry.\n\n#### 4. Improve Stop Loss Placement and Volatility Assessment\n   - **Issue**: The stop loss at $4691.69 was triggered quickly, suggesting it was too tight for the inherent volatility of XAUUSD or failed to account for potential short-term reversals.\n   - **Actionable Insight**: Use historical volatility data (e.g., Average True Range, ATR) to set stop losses that accommodate normal price fluctuations. Alternatively, place stops below key support levels rather than a fixed percentage.\n   - **Implementation**: Calculate ATR over the past 14-20 periods to determine a volatility-adjusted stop loss. Test stop loss strategies in backtesting to ensure they balance risk and premature exits.\n\n#### 5. Reassess Entry Timing and Short-Term Momentum\n   - **Issue**: The rapid price drop within 24 hours suggests the entry timing may have been poor, possibly entering during a short-term peak or against momentum.\n   - **Actionable Insight**: Incorporate short-term momentum indicators (e.g., RSI divergence, candlestick patterns, or volume analysis) to confirm entry timing. Avoid entries during overbought conditions or ahead of major news events unless supported by strong evidence.\n   - **Implementation**: Add a rule to delay entry until confirmation of momentum (e.g., RSI below 70 for a BUY, breakout above resistance with volume). Monitor economic calendars to avoid trading during high-impact news releases unless the prediction explicitly accounts for such events.\n\n#### 6. Conduct Post-Trade Analysis of Rapid Movements\n   - **Issue**: The -4.15% drop within 24 hours may have been driven by an unforeseen event or market dynamic not captured in the analysis.\n   - **Actionable Insight**: After every trade, investigate the cause of significant price movements (e.g., news releases, central bank announcements, or shifts in correlated assets like the USD). Use this to identify blind spots in the original analysis.\n   - **Implementation**: Maintain a trade journal with a section for \u201cpost-trade catalysts\u201d to document external factors influencing outcomes. Adjust future analysis to include real-time monitoring of breaking news or correlated markets (e.g., DXY for XAUUSD).\n\n#### 7. Test and Validate Prediction Models\n   - **Issue**: The prediction failed despite a structured approach, suggesting potential flaws in the decision-making model or overreliance on certain factors.\n   - **Actionable Insight**: Regularly backtest the prediction framework using historical data to assess its accuracy across different market conditions. Identify patterns in failed predictions (e.g., specific indicators or market environments) to refine the model.\n   - **Implementation**: Simulate trades over the past 6-12 months using the same methodology and compare predicted vs. actual outcomes. Adjust weighting of technical, fundamental, and sentiment inputs based on backtest results.\n\n---\n\n### Summary of Actionable Improvements\n| **Area**                       | **Key Issue**                                    | **Actionable Solution**                                                                 |\n|--------------------------------|-------------------------------------------------|----------------------------------------------------------------------------------------|\n| Data Completeness             | Missing technical indicators                    | Use alternative tools or qualitative analysis; adjust confidence for data gaps.        |\n| Confidence Assessment         | Overly optimistic confidence (70%)              | Develop a structured scoring system for confidence based on data alignment.           |\n| Macro/Sentiment Integration   | Unclear weighting of news and sentiment         | Document and score fundamental/sentiment factors; reconcile with technical signals.   |\n| Stop Loss Placement           | Stop loss too tight for volatility              | Use ATR or support levels for stop loss; backtest placement strategies.               |\n| Entry Timing                  | Poor timing led to rapid loss                   | Confirm short-term momentum; avoid high-impact news unless accounted for.             |\n| Post-Trade Analysis           | Unforeseen rapid movement not explained         | Investigate catalysts post-trade; monitor real-time news and correlated assets.        |\n| Model Validation              | Prediction framework may have flaws             | Backtest methodology regularly; adjust input weightings based on historical accuracy.  |\n\n---\n\n### Conclusion\nThe incorrect BUY prediction for XAUUSD highlights the need for a more robust and adaptive trading framework. By addressing gaps in data, refining confidence and risk assessments, improving stop loss and timing strategies, and conducting thorough post-trade analysis, future predictions can be made more accurate and resilient to market volatility. Implementing these lessons through systematic testing and documentation will build a stronger foundation for decision-making in volatile markets like gold."
}