{
  "symbol": "XAUUSD",
  "analysis_timestamp": "2026-01-07T09:11:22.611532",
  "evaluation_timestamp": "2026-01-09T09:00:45.884879",
  "price_at_analysis": 4496.35,
  "price_at_evaluation": 4482.55,
  "pct_change": -0.3069156093275697,
  "expected_direction": "up",
  "actual_direction": "down",
  "signal": "BUY",
  "prediction_correct": false,
  "hypothetical_pnl": -0.3069156093275697,
  "lesson": "ANALYSIS: The prediction to BUY XAUUSD on January 7, 2026, was incorrect as the price moved downward by 0.31% within 24 hours, from $4496.35 to $4482.55. The reasoning provided focused on a synthesis of risk perspectives (Risky, Neutral, Safe/Conservative) and aimed to refine the trader\u2019s plan, but it appears to have overestimated bullish signals or failed to account for bearish pressures in the market during this short timeframe. The lack of complete technical indicator data and potential over-reliance on subjective debate synthesis may have contributed to the misjudgment of the market direction.\n\nPREDICTIVE FACTORS: There were no clear predictive factors aligning with the actual downward movement in the provided analysis excerpt, as the focus was on a BUY signal. If any bearish news or sentiment data from the Comprehensive Report (December 31, 2025 \u2013 January 6, 2026) indicated potential downside risk for XAUUSD, such as rising interest rates or a stronger USD, these could have been predictive but were not highlighted in the decision-making process.\n\nMISLEADING FACTORS: The primary misleading factor was the apparent overconfidence in the bullish outlook derived from the Risk Management Judge\u2019s synthesis of analyst perspectives, which did not adequately weigh potential downside risks. Additionally, the incomplete technical indicator data (e.g., missing SMA, MACD Histogram, Bollinger Bands) likely limited the ability to objectively assess overbought conditions or reversal signals that could have suggested a downward move. The lack of emphasis on recent news or sentiment data pointing to bearish drivers for XAUUSD may have also skewed the analysis toward an incorrect BUY signal.\n\nLESSON: For future predictions, prioritize integrating complete and relevant technical indicator data to objectively validate directional signals before finalizing a decision, ensuring no critical metrics are missing. Cross-reference subjective debate outcomes with real-time news and sentiment analysis to balance bullish and bearish perspectives, especially for short-term trades. Implement a stricter risk assessment checklist to identify potential reversal risks, even in seemingly favorable setups."
}