{
  "symbol": "XAUUSD",
  "analysis_timestamp": "2026-02-02T08:16:21.907493",
  "evaluation_timestamp": "2026-02-03T09:05:40.027663",
  "price_at_analysis": 4885.6,
  "price_at_evaluation": 4670.73,
  "pct_change": -4.398026854429359,
  "expected_direction": "up",
  "actual_direction": "down",
  "signal": "BUY",
  "prediction_correct": false,
  "hypothetical_pnl": -4.398026854429359,
  "lesson": "### Analysis of Prediction Outcome and Lessons for Improvement\n\nThe prediction made for XAUUSD was a **BUY** signal with an expected upward price movement, based on a 70% confidence level and a medium risk assessment. However, the actual outcome after 24 hours was a downward movement of -4.40%, with the price dropping from $4885.60 to $4670.73. This resulted in a loss, as the price moved toward the stop loss level of $4691.69. Below is a structured analysis of the prediction and actionable lessons for improving future predictions.\n\n---\n\n### Key Observations from Prediction and Outcome\n1. **Mismatch Between Prediction and Outcome**:\n   - The predicted direction (up) was incorrect, as the price moved downward significantly (-4.40%) within 24 hours.\n   - The stop loss ($4691.69) was nearly triggered, indicating that the risk management parameters were close to being breached.\n   - The take-profit levels ($5013.16 and $5400.0) were far from being achieved, suggesting over-optimism in the expected upward movement.\n\n2. **Confidence and Risk Assessment**:\n   - The confidence level of 70% did not align with the outcome, raising questions about the reliability of the confidence metric or the underlying analysis.\n   - A \"medium\" risk level with a reduced position size (1% of portfolio) was a prudent decision, as it limited exposure to the loss. However, the risk/reward ratio of 1.50 may not have been adequately justified given the outcome.\n\n3. **Data and Indicator Limitations**:\n   - Some technical indicators (e.g., macdh, boll_ub, boll_lb) were unsupported by the system, potentially limiting the depth of technical analysis.\n   - The available indicators (e.g., SMA, EMA, MACD, RSI) may not have provided a complete or accurate picture of market momentum or trend reversal risks.\n\n4. **Incomplete Rationale**:\n   - The provided rationale snippet cuts off abruptly and lacks detailed reasoning behind the BUY decision. This makes it difficult to fully assess the logic behind the prediction.\n   - The influence of news and sentiment reports (e.g., global economic state, social media sentiment) on the decision is unclear from the provided information.\n\n---\n\n### Structured Lessons for Improvement\n\n#### 1. Enhance Data and Indicator Coverage\n   - **Issue**: Missing indicators (e.g., Bollinger Bands, MACD Histogram) limited the depth of technical analysis, potentially leading to an incomplete assessment of market conditions.\n   - **Actionable Insight**: Ensure access to a broader set of technical indicators or alternative data sources to capture critical signals such as volatility (Bollinger Bands) or momentum divergence (MACD Histogram). If certain indicators are unsupported, consider integrating external tools or platforms for a more comprehensive analysis.\n   - **Implementation**: Develop a checklist of essential indicators for every analysis and flag any missing data as a risk factor. Explore alternative data sources or APIs to fill gaps in indicator availability.\n\n#### 2. Refine Confidence and Risk Assessment\n   - **Issue**: The 70% confidence level did not reflect the actual outcome, and the risk/reward ratio (1.50) may have been overly optimistic given the sharp downward movement.\n   - **Actionable Insight**: Reassess how confidence levels are calculated by incorporating historical accuracy of similar setups or signals. Adjust risk/reward ratios to be more conservative in volatile markets or when key data is missing.\n   - **Implementation**: Use a backtesting framework to evaluate the historical success rate of predictions with similar indicator patterns and confidence levels. Introduce a dynamic risk/reward adjustment based on market volatility (e.g., using ATR - Average True Range).\n\n#### 3. Strengthen Rationale and Decision-Making Transparency\n   - **Issue**: The rationale for the BUY decision was incomplete in the provided text, making it unclear how much weight was given to technical, fundamental (news), or sentiment factors.\n   - **Actionable Insight**: Document a clear, structured rationale for every prediction, explicitly stating the weight or importance of each factor (e.g., 50% technical, 30% news, 20% sentiment). This transparency aids in post-mortem analysis and identifying flawed reasoning.\n   - **Implementation**: Create a standardized template for decision-making that includes sections for technical analysis, fundamental drivers (news), and sentiment analysis, with specific justifications for the final call.\n\n#### 4. Incorporate Early Warning Signals for Trend Reversals\n   - **Issue**: The sharp downward movement (-4.40%) suggests that a bearish reversal or momentum shift may have been underway, which was not captured in the analysis.\n   - **Actionable Insight**: Integrate early warning signals such as price action patterns (e.g., bearish candlestick formations), volume spikes, or divergence in momentum indicators (e.g., RSI divergence) to flag potential reversals before entering a position.\n   - **Implementation**: Add a pre-trade checklist for reversal risks, including checks for overbought/oversold conditions (via RSI) and bearish/bullish divergence in momentum indicators. Use shorter timeframes (e.g., 1H or 4H charts) alongside daily data to spot intraday shifts.\n\n#### 5. Leverage News and Sentiment More Effectively\n   - **Issue**: The role of news (global economic state) and social media sentiment in the decision-making process is unclear, yet these factors often drive short-term movements in XAUUSD due to its safe-haven status.\n   - **Actionable Insight**: Develop a scoring system for news and sentiment impact (e.g., positive/negative/neutral with weighted scores) and integrate these into the final decision. For gold, pay particular attention to macroeconomic events (e.g., interest rate changes, USD strength, geopolitical risks).\n   - **Implementation**: Use natural language processing (NLP) tools to quantify sentiment from social media and news reports. Create a \"news impact calendar\" to track high-impact events (e.g., Fed announcements) and adjust trade timing or position sizing accordingly.\n\n#### 6. Optimize Stop Loss and Take Profit Levels\n   - **Issue**: The stop loss ($4691.69) was nearly triggered, and take-profit levels ($5013.16, $5400.0) were unrealistic given the 24-hour timeframe and market volatility.\n   - **Actionable Insight**: Set stop loss and take-profit levels based on recent price volatility (e.g., ATR) and key support/resistance levels rather than arbitrary percentages or fixed points. Consider shorter-term targets for intraday or 24-hour predictions.\n   - **Implementation**: Use ATR-based stop loss and take-profit calculations to account for market volatility (e.g., stop loss at 2x ATR below entry). Identify key psychological levels or historical support/resistance zones for more realistic targets.\n\n#### 7. Improve Post-Trade Review Process\n   - **Issue**: The provided analysis lacks a detailed post-trade review to identify specific reasons for the incorrect prediction (e.g., unexpected news, technical misinterpretation).\n   - **Actionable Insight**: Conduct a thorough post-trade analysis for every prediction, categorizing the reasons for success or failure (e.g., technical error, external shock, sentiment misread) to build a knowledge base for future trades.\n   - **Implementation**: Develop a post-trade review template that includes sections for outcome analysis, contributing factors to the result, and lessons learned. Maintain a database of past trades to identify recurring patterns in incorrect predictions.\n\n---\n\n### Summary of Key Recommendations\n1. Ensure access to a complete set of technical indicators and flag missing data as a risk factor.\n2. Refine confidence and risk/reward calculations using historical data and volatility metrics.\n3. Document clear, structured rationales for every decision, with explicit weighting of factors.\n4. Incorporate early warning signals for trend reversals using price action and momentum indicators.\n5. Quantify the impact of news and sentiment using scoring systems and NLP tools.\n6. Optimize stop loss and take-profit levels based on volatility (ATR) and key market levels.\n7. Establish a robust post-trade review process to systematically learn from outcomes.\n\nBy implementing these actionable insights, future predictions can be made more robust, with improved accuracy and risk management. The focus should be on building a data-driven, transparent, and adaptive trading framework to better navigate the complexities of markets like XAUUSD."
}