{
  "symbol": "XAUUSD",
  "analysis_timestamp": "2026-01-02T21:44:43.312254",
  "evaluation_timestamp": "2026-01-04T09:00:29.374341",
  "price_at_analysis": 4395.45,
  "price_at_evaluation": 4332.93,
  "pct_change": -1.4223799610961227,
  "expected_direction": "up",
  "actual_direction": "down",
  "signal": "BUY",
  "prediction_correct": false,
  "hypothetical_pnl": -1.4223799610961227,
  "lesson": "ANALYSIS: The prediction to BUY XAUUSD at $4395.45 with an expected upward direction was incorrect, as the price dropped by 1.42% to $4332.93 within 24 hours. The reasoning provided in the prediction focused on a structured debate among different risk perspectives (Risky, Neutral, Safe/Conservative Analysts), but it lacked specific, data-driven insights or clear reference to critical market conditions, news, or sentiment that might have influenced the price movement. The actual downward movement suggests that bearish factors, potentially related to macroeconomic conditions or sentiment not adequately addressed in the analysis, dominated the market during this period.\n\nPREDICTIVE FACTORS: There were no explicitly predictive factors in the provided analysis that aligned with the actual downward movement of XAUUSD. The analysis snippets on market data, news, and sentiment were incomplete and did not offer clear bearish signals that could have anticipated the price drop.\n\nMISLEADING FACTORS: The primary misleading factor was the over-reliance on a debate framework without grounding the BUY decision in concrete, actionable data such as technical indicators (e.g., SMA trends), specific news events, or negative sentiment for XAUUSD. The mention of non-trading days and missing SMA data (e.g., close_200_sma from 2025-12-03 to 2026-01-02) suggests a potential gap in critical technical analysis, which might have obscured warning signs of a downward trend. Additionally, the incomplete references to news and sentiment reports failed to highlight any bearish catalysts that could have contradicted the BUY signal.\n\nLESSON: Future predictions should prioritize integrating specific, real-time data points\u2014such as technical indicators, key news events, and quantified sentiment scores\u2014over relying solely on qualitative debate frameworks to ensure a balanced view of market conditions. Always verify the availability and completeness of critical data (e.g., SMA values) before making a call, and incorporate a checklist of bearish and bullish catalysts to avoid missing contrary signals."
}