{
  "symbol": "XAUUSD",
  "analysis_timestamp": "2026-01-30T09:09:41.726299",
  "evaluation_timestamp": "2026-02-01T09:00:32.907562",
  "price_at_analysis": 5435.76,
  "price_at_evaluation": 4885.6,
  "pct_change": -10.12112381709273,
  "expected_direction": "up",
  "actual_direction": "down",
  "signal": "BUY",
  "prediction_correct": false,
  "hypothetical_pnl": -10.12112381709273,
  "lesson": "### Analysis of Prediction Outcome and Lessons for Improvement\n\nThe prediction for XAUUSD was a BUY signal with an expected upward price movement. However, the actual outcome after 24 hours showed a significant downward movement of -10.12%, with the price dropping from $5435.76 (at analysis) to $4885.60. This resulted in a loss, as the price moved well below the stop loss of $5180.0. Below is a structured analysis of the prediction and actionable lessons for improving future trading decisions.\n\n---\n\n### Key Observations from Prediction and Outcome\n1. **Incorrect Directional Prediction**:\n   - The prediction anticipated an upward movement with 85% confidence, but the market moved sharply downward. This suggests a potential overconfidence in the analysis or a misinterpretation of key signals.\n   - The price at analysis ($5435.76) was higher than the entry price ($5389.45), indicating the trade was initiated slightly below the analyzed price, yet the downward movement was severe enough to trigger the stop loss.\n\n2. **Risk Management Parameters**:\n   - The stop loss ($5180.0) was set, limiting potential losses to a predefined level, and the risk/reward ratio (1.86) was reasonable. However, the rapid price decline suggests that the stop loss might not have been tight enough to prevent significant loss given the volatility.\n   - Position sizing was reduced (3-4% of portfolio), which was a prudent decision and likely mitigated a larger loss.\n\n3. **Incomplete Data**:\n   - The analysis noted that some technical indicators (e.g., MACD, Bollinger Bands) were unavailable due to system limitations. This may have led to an incomplete assessment of market conditions.\n   - The rationale for the BUY signal was not fully detailed in the provided text, making it unclear which specific factors (technical, fundamental, or sentiment) were weighted most heavily.\n\n4. **Market and News Context**:\n   - The analysis referenced news and sentiment reports for XAUUSD from January 23-30, 2026. However, specific details about macroeconomic conditions or sentiment drivers (e.g., interest rate expectations, geopolitical events, or USD strength) that could have influenced gold prices were not provided in the excerpt.\n   - A sharp -10.12% drop in 24 hours suggests a significant adverse event or shift in market sentiment that was not anticipated in the analysis.\n\n---\n\n### Lessons for Improvement\nBelow are actionable insights categorized into key areas to enhance future predictions and decision-making processes.\n\n#### 1. Enhance Data Completeness and Indicator Coverage\n- **Issue**: Missing technical indicators (e.g., MACD, Bollinger Bands) likely limited the ability to assess momentum and volatility accurately.\n- **Actionable Insight**: Ensure access to a full suite of technical indicators before making a trading decision. If certain indicators are unavailable, consider alternative tools (e.g., RSI for momentum, ATR for volatility) or delay the trade until data is complete.\n- **Implementation**: Develop a checklist of essential indicators and data points required for analysis. If critical data is missing, flag the analysis as incomplete and reduce confidence in the prediction or avoid trading.\n\n#### 2. Reassess Confidence Calibration\n- **Issue**: The prediction was made with 85% confidence, yet the outcome was a significant loss, indicating potential overconfidence.\n- **Actionable Insight**: Implement a more rigorous confidence calibration process. Confidence levels should be tied to the strength and completeness of data, historical accuracy of similar setups, and alignment between technical, fundamental, and sentiment factors.\n- **Implementation**: Use a scoring system to assign confidence based on predefined criteria (e.g., 20% for data completeness, 30% for indicator alignment, 25% for fundamental support, 25% for sentiment). Lower confidence if any factor is weak or missing.\n\n#### 3. Improve Risk Management and Stop Loss Placement\n- **Issue**: While a stop loss was in place, the -10.12% drop suggests that volatility was underestimated, and the stop loss may have been too wide given the time frame (24 hours).\n- **Actionable Insight**: Adjust stop loss levels based on recent volatility (e.g., using Average True Range (ATR)) and the time frame of the trade. For short-term trades like this (24 hours), tighter stop losses may be necessary to limit downside risk.\n- **Implementation**: Calculate stop loss dynamically using volatility metrics (e.g., 1.5x ATR for short-term trades). Additionally, consider trailing stops to lock in profits if the price moves favorably before reversing.\n\n#### 4. Incorporate Real-Time News and Sentiment Monitoring\n- **Issue**: The sharp price decline suggests an unexpected event or shift in market sentiment that was not accounted for in the analysis.\n- **Actionable Insight**: Integrate real-time news and sentiment analysis into the decision-making process, especially for assets like gold, which are sensitive to macroeconomic events (e.g., central bank policies, geopolitical tensions, USD movements).\n- **Implementation**: Use automated news alerts or sentiment tracking tools to monitor breaking news and social media trends. Establish a protocol to reassess open positions or pending trades if significant news contradicts the original analysis.\n\n#### 5. Deepen Fundamental Analysis for XAUUSD\n- **Issue**: The provided text lacks specific details on fundamental drivers (e.g., interest rates, inflation expectations, USD strength) that heavily influence gold prices.\n- **Actionable Insight**: Strengthen the fundamental analysis by prioritizing key drivers of gold prices, such as real interest rates, inflation data, and currency correlations (especially USD). Cross-check technical signals with fundamental context to avoid misaligned predictions.\n- **Implementation**: Create a fundamental checklist for XAUUSD trades, including recent central bank statements, economic data releases (e.g., CPI, Fed minutes), and USD index trends. Weight fundamental factors alongside technical indicators in the decision-making process.\n\n#### 6. Post-Mortem Analysis of Significant Losses\n- **Issue**: The root cause of the -10.12% drop is unclear from the provided data, limiting the ability to pinpoint specific failures in the analysis.\n- **Actionable Insight**: Conduct a detailed post-mortem for every significant loss to identify whether the error stemmed from data, methodology, or external factors. Use these findings to refine the trading system.\n- **Implementation**: Develop a standardized post-trade review template that includes sections for data used, assumptions made, external events at the time of the trade, and lessons learned. Track recurring issues to identify systemic weaknesses.\n\n#### 7. Test and Refine Predictive Models\n- **Issue**: The prediction failed despite a structured debate between Risky, Neutral, and Safe Analysts, suggesting that the decision-making framework or weighting of arguments may need adjustment.\n- **Actionable Insight**: Backtest the predictive model or decision framework using historical data to evaluate its accuracy across different market conditions. Identify patterns in failed predictions to refine the model.\n- **Implementation**: Simulate past trades using the same methodology and compare predicted versus actual outcomes. Adjust the weighting of analyst perspectives (e.g., give more weight to Safe Analyst in high-volatility environments) based on historical performance.\n\n---\n\n### Summary of Key Recommendations\n| **Area**                  | **Recommendation**                                                                 | **Priority** |\n|---------------------------|-----------------------------------------------------------------------------------|--------------|\n| Data Completeness         | Ensure access to all critical indicators or use alternatives if unavailable.      | High         |\n| Confidence Calibration    | Tie confidence to data strength and historical accuracy using a scoring system.   | High         |\n| Risk Management           | Adjust stop loss dynamically based on volatility (e.g., ATR) for short-term trades.| Medium       |\n| News/Sentiment Monitoring | Integrate real-time news and sentiment tools to capture unexpected events.        | High         |\n| Fundamental Analysis      | Prioritize key drivers of XAUUSD (e.g., interest rates, USD strength).            | Medium       |\n| Post-Mortem Analysis      | Conduct detailed reviews of losses to identify root causes.                      | Medium       |\n| Model Testing             | Backtest and refine decision framework based on historical data.                 | Medium       |\n\n---\n\n### Conclusion\nThe incorrect BUY prediction for XAUUSD, resulting in a -10.12% loss, highlights gaps in data completeness, overconfidence, and potential underestimation of volatility or adverse events. By implementing the above lessons\u2014focusing on robust data, real-time monitoring, refined risk management, and continuous model improvement\u2014future predictions can be made more accurate and resilient to unexpected market movements. Immediate priorities should include ensuring data completeness, recalibrating confidence levels, and integrating real-time news/sentiment tools to avoid similar losses in volatile markets."
}