{
  "symbol": "XAUUSD",
  "analysis_timestamp": "2026-01-29T09:12:22.348662",
  "evaluation_timestamp": "2026-01-31T09:00:44.521387",
  "price_at_analysis": 5461.53,
  "price_at_evaluation": 4885.6,
  "pct_change": -10.54521352075333,
  "expected_direction": "up",
  "actual_direction": "down",
  "signal": "BUY",
  "prediction_correct": false,
  "hypothetical_pnl": -10.54521352075333,
  "lesson": "### Analysis of Prediction Outcome and Lessons for Improvement\n\nThe prediction for XAUUSD (Gold) was a BUY with a 75% confidence level and a medium risk level. However, the actual outcome 24 hours later showed a significant downward movement of -10.55%, with the price dropping from $5461.53 (price at analysis) to $4885.60. This resulted in a loss, as the price moved well below the stop loss level of $5312.31. Below is a structured analysis of the outcome and actionable lessons for improving future predictions.\n\n---\n\n### Key Observations from Prediction and Outcome\n1. **Incorrect Directional Prediction**:\n   - The prediction expected an upward movement, but the market moved sharply downward by 10.55% within 24 hours.\n   - This indicates a misjudgment in the market trend or failure to account for bearish catalysts.\n\n2. **Risk Management Parameters**:\n   - The stop loss was set at $5312.31, which was triggered during the price drop, limiting losses to some extent.\n   - The risk/reward ratio of 1.80 was reasonable, but the position sizing (reduced to 20% initial exposure) suggests caution was already factored in, though not enough to prevent a significant loss.\n\n3. **Confidence and Rationale**:\n   - The confidence level of 75% was relatively high, but the reasoning provided (partially cut off) mentioned a \"compelling bull\" case, which may have been overly optimistic or based on incomplete data.\n   - The analysis included inputs from Risky, Neutral, and Safe Analysts, but the final decision favored a bullish outlook, potentially overlooking dissenting bearish views.\n\n4. **External Factors**:\n   - The analysis mentions indicator data (Bollinger Bands, ATR), news, and sentiment reports, but specific details on bearish signals or potential downside risks are not evident in the provided excerpt.\n   - The sharp price drop suggests a major market event or shift in sentiment may have occurred within the 24-hour window, which was not anticipated.\n\n---\n\n### Lessons for Improvement\nBelow are actionable insights categorized into key areas to enhance future trading predictions and decision-making processes.\n\n#### 1. Enhance Market Trend Analysis\n- **Lesson**: The sharp downward movement indicates that the bullish trend analysis may have been based on incomplete or outdated data. Over-reliance on a single perspective (bullish) may have ignored critical bearish signals.\n- **Actionable Insight**:\n  - Incorporate a more robust trend confirmation process using multiple timeframes (e.g., daily, 4-hour, 1-hour charts) to validate the primary direction.\n  - Use leading indicators (e.g., RSI divergence, MACD crossovers) alongside lagging indicators (e.g., moving averages) to identify potential reversals or weakening trends before entering a position.\n  - Weight dissenting analyst opinions (e.g., Safe or Risky Analyst views) more heavily in the final decision to avoid confirmation bias.\n\n#### 2. Strengthen Risk Management\n- **Lesson**: While the stop loss and reduced position sizing mitigated some losses, the rapid price drop suggests that the stop loss may have been too wide, and the position was still exposed to significant risk.\n- **Actionable Insight**:\n  - Tighten stop loss levels for medium-risk trades, especially in volatile markets like XAUUSD, to minimize losses during sudden reversals. For instance, consider placing the stop loss closer to key support levels or based on ATR multiples (e.g., 1.5x ATR).\n  - Implement trailing stops to lock in profits or limit losses dynamically if the price starts moving against the position.\n  - Further reduce position sizing for trades with only moderate confidence (e.g., below 80%) to limit exposure during uncertain market conditions.\n\n#### 3. Improve Integration of News and Sentiment Data\n- **Lesson**: The provided excerpts mention news and sentiment reports, but there is no indication that potential bearish catalysts (e.g., macroeconomic events, central bank announcements, or shifts in investor sentiment) were adequately factored into the decision.\n- **Actionable Insight**:\n  - Develop a checklist of high-impact events (e.g., US Federal Reserve decisions, geopolitical tensions, inflation data) that could affect XAUUSD and assign risk scores to each event before entering a trade.\n  - Use real-time sentiment analysis tools (e.g., social media sentiment trackers) to monitor sudden shifts in market perception that could contradict technical analysis.\n  - Cross-reference news data with historical price reactions to similar events to better anticipate potential market moves.\n\n#### 4. Reassess Confidence Calibration\n- **Lesson**: The 75% confidence level appears overly optimistic given the outcome. This suggests a potential overconfidence bias in the prediction process.\n- **Actionable Insight**:\n  - Calibrate confidence levels based on historical accuracy of similar setups. For instance, if past BUY predictions for XAUUSD under similar conditions have a lower success rate, adjust confidence downward accordingly.\n  - Introduce a post-analysis review of confidence scores after each trade to identify patterns of overconfidence or underconfidence and refine the decision-making framework.\n  - Require a higher confidence threshold (e.g., 80% or above) for trades with medium or high risk levels to avoid acting on uncertain predictions.\n\n#### 5. Incorporate Contingency Planning for Unexpected Moves\n- **Lesson**: The 10.55% drop within 24 hours indicates a significant, unexpected market event or volatility spike that was not anticipated in the analysis.\n- **Actionable Insight**:\n  - Build scenario analysis into the prediction process, including worst-case scenarios (e.g., sudden bearish news or technical breakdowns) and their potential impact on price.\n  - Set up automated alerts for high-volatility events or price breaches of critical levels (e.g., below key support) to enable rapid response or position adjustments.\n  - Consider hedging strategies (e.g., options or inverse positions) for medium-risk trades to protect against unexpected adverse movements.\n\n#### 6. Post-Trade Analysis and Feedback Loop\n- **Lesson**: The current analysis does not indicate whether past prediction errors were reviewed or incorporated into the decision-making process, which may have contributed to repeating similar mistakes.\n- **Actionable Insight**:\n  - Maintain a detailed trade journal to document each prediction, including rationale, confidence, outcome, and key lessons. Review this journal weekly to identify recurring errors or biases.\n  - Conduct a root cause analysis for every incorrect prediction to pinpoint whether the error stemmed from technical misjudgment, news oversight, or other factors.\n  - Use machine learning or statistical models to analyze historical prediction data and identify patterns that improve future accuracy (e.g., success rates by indicator combinations or market conditions).\n\n---\n\n### Summary of Key Improvements\nTo improve future predictions for XAUUSD and similar assets, focus on the following priorities:\n1. **Balanced Trend Analysis**: Avoid over-reliance on a single directional bias by integrating multi-timeframe analysis and dissenting opinions.\n2. **Tighter Risk Controls**: Implement stricter stop losses, smaller position sizes, and dynamic risk management tools like trailing stops.\n3. **Comprehensive Data Integration**: Factor in real-time news, sentiment shifts, and high-impact events with clear risk assessments.\n4. **Confidence Calibration**: Adjust confidence levels based on historical accuracy and set higher thresholds for riskier trades.\n5. **Proactive Contingency Planning**: Prepare for unexpected market moves through scenario analysis, alerts, and hedging.\n6. **Continuous Learning**: Establish a robust feedback loop via trade journals and post-trade analysis to refine strategies over time.\n\nBy implementing these actionable insights, future predictions can be made more accurate, and losses from incorrect calls can be minimized."
}